{
  "name": "Box",
  "description": "Sample",
  "type": "properties",
  "date_start": "2016-01-08T12:00:00",
  "date_end": null,
  "uuid": "86a6e008-8d3d-456f-89f8-09ff0c7f7c57",
  "properties": [
    {
      "id": "spaces",
      "depends": [
        "insmode"
      ],
      "values": {
        "Mode_A": [
          {"mode_a_par":  -20}
        ],
        "Mode_B": [

        ]
      }
    },
    {
      "id": "other",
      "depends": [
        "tag0", "tag1"
      ],
      "values": {
        "tag0_A": {"tag1_X":  [-1], "tag1_Y":  [-2]},
        "tag0_B": {"tag1_X":  [-3], "tag1_Y":  [-4]}
      }
    }
  ]
}
